Type,Category,Question,Best Answer,Correct Answers,Incorrect Answers
MMLU,professional_law,"A man entered a tavern in an obviously intoxicated condition, was refused service, and was ordered to leave and escorted out. Just after leaving the tavern, the man staggered across the road toward a liquor store. As he was crossing the road, the man was struck by a car and severely injured. The man sued the tavern for his personal injuries. At trial, the evidence established the facts as set out above. At the close of the evidence, both parties moved for judgment as a matter of law. How should the court rule on these motions?","Grant the tavernÕs motion, because there is no evidence that the tavern breached a duty to the man.","Grant the tavernÕs motion, because there is no evidence that the tavern breached a duty to the man.","Deny both motions and submit the case to the jury, because reasonable jurors could conclude that the accident was foreseeable.; Deny both motions and submit the case to the jury, because a tavern is a place of public accommodation.; Grant the manÕs motion, because it is undisputed that by being ejected from the tavern, the man was put at risk."
MMLU,professional_law,"A man has sued a police officer, alleging that the officer violated the man's civil rights by using excessive force while arresting him. At trial, the officer admits having hit the man in the head with the butt of his gun, but contends that the force was necessary, because the man was resisting arrest. In support of his contention, the officer seeks to introduce evidence that the man had resisted arrest on three prior occasions during the last 10 years. Is this testimony regarding the man's conduct during the three prior arrests admissible? ?","No, because evidence of the prior incidents constitutes impermissible character evidence.","No, because evidence of the prior incidents constitutes impermissible character evidence.","No, because the officer has not shown that the man was convicted in connection with the prior incidents.; Yes, because the incidents in question are relevant evidence of the man's propensity for violence.; Yes, because the incidents in question are sufficient to constitute a habit."
MMLU,professional_law,"A farmer contracted to sell 100 tons of his home-grown cucumbers to a wholesaler. An invasion of cucumber-eating insects attacked the crop and made it a poor season. The farmer delivered only 60 tons. The wholesaler claimed a breach of contract due to his being shorted 40 tons. The farmer sued the wholesaler for payment on the 60 tons, and the wholesaler counterclaimed for damages caused by the loss of the additional 40 tons. What is the most likely decision of the court?",There is an industry-wide implied condition that natural causes could limit the amount of an agricultural product -- the wholesaler must pay for the 60 tons and gets no credit on the rest.,There is an industry-wide implied condition that natural causes could limit the amount of an agricultural product -- the wholesaler must pay for the 60 tons and gets no credit on the rest.,"The farmer could have used insecticide to kill the insects, he breached the contract, and gets nothing.; The farmer breached the contract but he's entitled to be paid for the 60 tons, less the amount of damages suffered by the wholesaler in not getting the full value of the bargain.; The farmer is entitled to collect on the 60 tons and will be reimbursed for the 40 unproduced tons by the federal government."
MMLU,professional_law,Local police received an anonymous letter that contained statements that a married couple was engaged in drug trafficking and were storing large amounts of contraband in their basement. The letter did not say how the writer personally knew that there were drugs or where they were stored. The investigating detective drew up an affidavit of probable cause based on the statements in the letter and presented the request for a search warrant and the affidavit to a magistrate judge. The magistrate judge signed a search warrant based on the affidavit. The police raided the home and found several pounds of cocaine in the basement. The defendants filed a motion to suppress the evidence based on insufficient cause to issue a warrant. The state courts rejected the suppression motion. What would the U.S. Supreme Court most likely decide?,The Court would invalidate the warrant because there was insufficient information and no corroboration to support the credibility and personal knowledge of the informant.,The Court would invalidate the warrant because there was insufficient information and no corroboration to support the credibility and personal knowledge of the informant.,"The Court would validate the search warrant because there were sufficient detailed allegations in the letter to justify a probable cause finding.; The warrant was valid because when the informant's information turns out to be true after the warrant is issued and executed, then that validates the affidavit of probable cause.; The warrant was invalid because affidavits of probable cause must give the name and address of the informant, an affidavit cannot be based on an anonymous informant."
MMLU,professional_law,"A husband, who was married to a wife, began dating another woman. The husband proposed marriage to the woman, who believed that the husband was single. The woman accepted the husband's marriage proposal and planned a wedding. The day before the wedding, the husband decided not to go through with the ceremony. He told his wife about his relationship with the woman. He then asked her to tell the woman that they were married and he would no longer be seeing her. The husband knew that the woman had a manic depressive personality and was mentally unstable. When the wife broke the news to the woman, she had an emotional breakdown that required hospitalization. The woman sued the husband for breach of contract to marry and intentional infliction of emotional distress. The husband has filed motions to dismiss both causes of action. The court should?","deny the motion to dismiss the claim for intentional infliction of emotional distress, but grant the motion to dismiss the claim for breach of contract because it is against public policy to enforce marriage agreements. .","deny the motion to dismiss the claim for intentional infliction of emotional distress, but grant the motion to dismiss the claim for breach of contract because it is against public policy to enforce marriage agreements. .","deny the motion to dismiss the claim for breach of contract to marry, but grant the motion to dismiss the action for infliction of emotional distress, because the husband's conduct was not extreme and outrageous. .; grant both motions to dismiss.; deny both motions, because the husband's conduct was extreme and outrageous and the court may grant relief for breach of contract, as well. ."
MMLU,professional_law,"A man was angry at a coworker who had received a promotion. The man believed that the coworker had taken credit for the man's work and had bad- mouthed him to their boss. One day, as the man was leaving the company parking lot in his car, he saw the coworker walking through the lot. On a sudden impulse, the man pushed the accelerator pedal hard and veered toward the coworker with the intention of scaring him. The coworker tried to jump out of the way but slipped and fell and was run over. Although the coworker suffered life-threatening injuries, he survived. In a jurisdiction that follows the common law of homicide, could the man properly be convicted of attempted murder? ?","No, because the man lacked the requisite intent.","No, because the man lacked the requisite intent.","No, because the coworker's slip and fall broke the chain of proximate causation.; Yes, because the coworker suffered life- threatening injuries.; Yes, because the man acted with reckless disregard for human life."
MMLU,professional_law,"A food manufacturer entered into a contract to buy all of the seller's bread crumb output. Several months after the contract was signed, the seller dismantled its machinery and stopped making bread crumbs. The buyer sued the seller. The seller testified and proved by expert evidence that it was no longer economically beneficial to produce bread crumbs. Will the court enforce the breach of contract action and award damages to the buyer?","No, the fact that the seller proved that it was economically unproductive means that the seller acted in good faith, and there was no further duty under the agreement.","No, the fact that the seller proved that it was economically unproductive means that the seller acted in good faith, and there was no further duty under the agreement.","Yes, an output contract must meet its output promises or the breaching party must pay reasonable damages.; Yes, the court will grant damages at least for the first year of operation so that the buyer recoups its initial losses.; No, the general promise of providing all of a company's output is considered an illusory promise that will not be enforced."
MMLU,professional_law,"A hardware store had a public pay telephone attached to the outside wall of its building. The telephone was owned and operated by the local telephone company. On Thursday, November 25, the store was closed for Thanksgiving. A resident, who lived two doors away, walked to the hardware store to use the telephone. He wanted to call his son and daughter- in-law to wish them a happy Thanksgiving, but his home phone was out of order. The resident picked up the receiver, inserted coins for the cost of the call, and promptly received an electric shock. Although the resident was momentarily stunned, he did not suffer any pain or injuries. Unbeknownst to the resident, a technician employed by the telephone company had incorrectly rewired the telephone the previous day, causing a short circuit in the telephone mechanism. If the resident institutes a personal injury action for negligence against the telephone company, he will most likely?","not recover, because the resident did not suffer any injuries. .","not recover, because the resident did not suffer any injuries. .","recover, because the technician's error would constitute the proximate cause of the resident's injuries. .; recover, because the technician's error was a substantial factor in causing the resident's injuries. .; recover, under the doctrine of respondeat superior."
MMLU,professional_law,"A boyfriend was unhappy in his relationship with his girlfriend. When the girlfriend got drunk, she would become abusive and beat her boyfriend. During the course of their relationship, the beatings became more violent and more frequent. Unable to endure the physical abuse any longer, the boyfriend hired a hit man to kill his girlfriend. One night while the girlfriend was asleep, the hit man entered the home with a key given to him by the boyfriend and shot the girlfriend to death. Afterward, the boyfriend was prosecuted for murder as an accomplice. The defense sought to have the judge instruct the jury that the boyfriend acted in self-defense. Based on the given facts, should the judge give such an instruction to the jury?","No, because the boyfriend's belief in the necessity of deadly force in self-defense was unreasonable. .","No, because the boyfriend's belief in the necessity of deadly force in self-defense was unreasonable. .","No, because the boyfriend could have avoided the danger by safely retreating. .; Yes, because a reasonable jury could conclude that the boyfriend acted in self-defense by using necessary force to protect himself from the girlfriend's constant violent attacks. .; Yes, because a criminal defendant's Sixth Amendment right to a jury trial prohibits a court from refusing to submit affirmative defenses to the jury. ."
MMLU,professional_law,"One night, a defendant went to play bingo. After losing at bingo, the defendant went on a violent rampage. He stole a car and then picked up a woman at a local bar. After she rejected his advances, the defendant stabbed her to death. The defendant was subsequently arrested and charged with felony- murder under an appropriate federal criminal statute. The defendant admitted committing the crime but pleaded not guilty by reason of insanity. At trial in federal court, the prosecuting attorney calls the defendant's psychiatrist to testify as to the defendant's mental state at the time of the killing. The defendant's attomey objects, claiming that the testimony would violate the psychiatrist-patient privilege. The objection should be?","sustained, provided the court concludes that the privilege should be recognized as part of modern common law. .","sustained, provided the court concludes that the privilege should be recognized as part of modern common law. .","sustained, provided the state law recognizes the psychiatrist-patient privilege. .; overruled, because no such privilege is specifically provided in the Federal Rules of Evidence. .; overruled, because the right to a fair trial overrides the use of a privilege to prevent full exploration of the facts in federal court. ."
MMLU,professional_law,"Ethyl Entertainer contracted with Grenda Gardener to provide daily flower arrangements for Ethyl's monthly tea and bridge parties. Both parties signed an agreement for 24 months at $20 per month, which stated ""Any change to this contract must be written."" The contract proceeded; Grenda appeared each month with a suitable bouquet, and Ethyl paid her $20 cash. After 15 months, the market price of flowers skyrocketed. Grenda telephoned Ethyl and said she had to raise the price to $25 per month. Ethyl agreed to the increase, but insisted on paying for all the flowers at the end of the nine months left on the agreement. After the final nine months, Ethyl refused to pay Grenda more than $180. If Grenda sues Ethyl, the court will most likely to find?",The modification from $20 to $25 per month was not enforceable because it was not written.,The modification from $20 to $25 per month was not enforceable because it was not written.,"The statute of frauds does not apply to the original contract because it was under $500.; The contract modification from $20 to $25 per month was not enforceable because it was not supported by new consideration.; The oral modification is conclusive evidence that the parties waived the ""written modifications only"" provision."
MMLU,professional_law,"An auto body shop operated for many years in a residential zoning district as a nonconforming use. The owner temporarily closed the business due to illness; while it was closed, he tried to sell it. Within a few months, he sold it to another auto body company. The zoning ordinance provided that when a nonconforming use was abandoned, it could not later be resurrected. The city claimed that the use was abandoned and could not be reopened. The zoning hearing board agreed. On appeal to the county court, what was the court's most likely decision?",The nonconforming use was still effective because this was a temporary cessation that did not constitute abandonment.,The nonconforming use was still effective because this was a temporary cessation that did not constitute abandonment.,The nonconforming use was abandoned because even a short cessation prevents it from being resurrected.; A sale of the premises constitutes an abandonment of the nonconforming use.; The nonconforming use was still effective because the abandonment rule in the ordinance was an unconstitutional prohibition on the right to use one's property.
MMLU,professional_law,"A man, a teenager, and a woman are siblings who inherited their father's farm when he died testate, leaving his farm to his children as joint tenants. Soon after the father's death, the teenager died and the woman moved to another part of the country. The man has not heard from the woman in many years. Prior to their father's death, the man and the teenager operated their father's farm. They continued doing so after their father died, sharing all expenses equally and dividing the profits between them. Following the teenager's death, the man has continued to operate the farm for his sole benefit. Recently, the man has granted a coal company rights to strip-mine coal from underneath the farm. Their agreement stipulated that the coal company would pay the man a per-ton royalty for the coal extracted. In addition, the coal company agreed to fill in the excavated area and replace top soil on the surface of the land. During the coal company's strip-mining operation, the woman returns to the farm and demands a proportionate share of the royalties paid to her brother (the man). Which of the following is the LEAST accurate statement regarding the woman's right to share in the royalties?","The woman's redomiciling constituted a severance of the joint tenancy, which resulted in a destruction of her interest in the mining royalties. .","The woman's redomiciling constituted a severance of the joint tenancy, which resulted in a destruction of her interest in the mining royalties. .","As a joint tenant, the woman would be entitled to contribution for a proportionate share of the royalties. .; It would be inequitable for one concurrent owner to receive an unapportionate share of the royalties.; Because the woman's redomiciling did not effectuate an ouster, she retained her right to contribution as a joint tenant. ."
MMLU,professional_law,"An owner of a pharmaceutical company manufactures aspirin tablets that it sells in interstate commerce. A woman purchased a bottle of the owner's aspirin from a drugstore. Shortly after taking two of the aspirin tablets, the woman became extremely ill and began having convulsions. She was rushed to the hospital, where it was determined that the aspirin tablets contained strychnine, a poisonous chemical. The owner of the pharmaceutical company is subsequently charged with violating a federal statute that makes it a misdemeanor to transport impure drugs in interstate commerce. The owner should be found?","guilty, only if he had the authority and responsibility for packaging the aspirin tablets. .","guilty, only if he had the authority and responsibility for packaging the aspirin tablets. .","guilty, only if he knew or should have known that the aspirin tablets were poisonous. .; guilty, only if he personally supervised the packaging of the aspirin tablets. .; guilty, only if he knew that other customers had purchased poisonous aspirin tablets in the past. ."
MMLU,professional_law,"The defendant is on trial for rape of the victim. On the night of the offense, the defendant drove the victim home and asked to come inside for a nightcap. The victim refused, saying she had to be up early in the morning. The defendant then forced the victim upstairs at gunpoint and raped her. During the trial, the defendant took the witness stand and testified that the victim gave him a ride in her car that evening and forced him to go to her house. The defendant's testimony may be used in a subsequent trial as evidence that the defendant committed the crime of?",peijury.,peijury.,misprision of felony.; misprision.; compounding a felony.
MMLU,professional_law,"One afternoon, a man was driving his car in the downtown section of a city. Already late for a  onsiness appointment, he was becoming very upset because of the heavy traffic. Suddenly, he decided to drive his car along the sidewalk to avoid the traffic jam. While he was speeding down the sidewalk, people were hastily scurrying to avoid his car. His car struck a pedestrian, who had tripped trying to get out of his way, killing her. Which of the following is the best theory regarding the man's criminal liability?","Commission of an act highly dangerous to life, without an intent to kill but with disregard for the consequences. .","Commission of an act highly dangerous to life, without an intent to kill but with disregard for the consequences. .","Felony murder, because he was committing an assault with a deadly weapon. .; Transferred intent, because one is presumed to intend the natural and probable consequences of his acts. .; Intentional killing, because the man's conduct was a substantial factor in causing the pedesthan's death. ."
MMLU,professional_law,"On June 1, a businessman opened a health and massage spa, which was located on First Street in the city. The spa also provided health club facilities, such as saunas, steam rooms, and whirlpool baths. A 75-year-old spinster resided across the street from the spa. The spinster opposed the opening of the spa because she believed that it was a ""cover"" for an illegal operation. During the day, the spinster sat in her rocking chair on her front porch and observed a constant stream of businessmen entering the spa. On the evening of June 29, the spinster, disguising her voice, called the spa and told the businessman, ""You pimp, why don't you take your dirty trade elsewhere?"" Without paying any attention to the call, the businessman hung up. The spinster then began making repeated crank telephone calls to the businessman's establishment. Every hour on the hour for the next three weeks, the spinster made her crank calls, harassing the businessman and his employees. As a result of the hourly phone calls, spa business was constantly disrupted, causing the businessman to suffer a decline in the volume of customers. After contacting the police, the businessman discovered that the spinster was the person making the harassing calls. If the businessman asserts a claim against the spinster, the theory on which he will most likely prevail is?",private nuisance.,private nuisance.,public nuisance.; intentional infliction of emotional distress.; negligence.
MMLU,professional_law,"A retailer brought a federal diversity action against an architect, alleging fraudulent misrepresentations in the architect's design of the retailer's store. The complaint did not include a jury demand. The architect timely moved to dismiss the action for failure to state a claim; he did not file an answer. Twenty days after being served with the motion, the retailer amended the complaint to add a defamation claim based on the architect's recent statements about the retailer in a local newspaper. In the amended complaint, the retailer demanded a jury trial on both claims. Has the retailer properly demanded a jury trial? ?","Yes, on both claims, because the architect had not answered the original complaint when the retailer filed the amended complaint with the jury demand.","Yes, on both claims, because the architect had not answered the original complaint when the retailer filed the amended complaint with the jury demand.","No, because the retailer filed the demand more than 14 days after service of the motion to dismiss.; No, because the retailer filed the demand more than 14 days after service of the original complaint.; Yes, but on the defamation claim only, because the original complaint did not contain a jury demand."
MMLU,professional_law,"A citizen of a state was arrested and charged under a state statute making it a felony for ""a male to sell or give alcoholic beverages to a female under the age of 14. "" At his trial, the citizen attacked the validity of the state statute on federal constitutional grounds. The court will likely hold the statute to be?","unconstitutional, because the law treats males and females differently without adequate justification and, therefore, is violative of the Fourteenth Amendment. .","unconstitutional, because the law treats males and females differently without adequate justification and, therefore, is violative of the Fourteenth Amendment. .","constitutional, because under the Twenty First Amendment, a state has exclusive authority to regulate the use and sale of intoxicating liquors. .; constitutional, because the state could reasonably believe that young females need more protection than young males under these circumstances. .; unconstitutional, because it lacks a legitimate purpose and, therefore, is violative of the Fourteenth Amendment. ."
MMLU,professional_law,"A homeowner owns a home in fee simple and leased it to his cousin for a term of 10 years. By the terms of the lease, the cousin expressly covenanted to pay a monthly rental of $300 and to pay the taxes on the premises during the term of the lease. The lease also stipulated that the cousin, as lessee, may not assign or sublease the said premises. The cousin and his family lived in the house for two years. Then the cousin, still owing the homeowner three months back rent, assigned his leasehold interest in the property to a friend, who was unaware of the prohibition against assignments. This written assignment expressly provided that the friend would pay the homeowner the monthly rental of $300, but was silent concerning the payment of taxes. After the cousin's assignment to the friend, the homeowner sues the cousin to recover the rent in arrears. The homeowner will most likely?","succeed, because the homeowner and the cousin stood in privity of contract. .","succeed, because the homeowner and the cousin stood in privity of contract. .","succeed, even though the homeowner had notice of the assignment. .; not succeed, because the cousin had assigned his interest in the premises before the homeowner brought suit. .; not succeed, because he did not object to the assignment. ."
