Type,Category,Question,Best Answer,Correct Answers,Incorrect Answers
MMLU,high_school_psychology,"""Psychology is the science of behavior and mental processes,"" commonly defines psychology. In their definition of psychology, behaviorists would be likely to eliminate?",III only.,III only.,I only.; II only.; I and III only.
MMLU,high_school_psychology,Which of the therapies listed below is no longer used to treat patients?,prefrontal lobotomy.,prefrontal lobotomy.,electro-convulsive shock therapy.; implosive therapy.; free association.
MMLU,high_school_psychology,Vance's therapist believes Vance is psychotic. From which of the following medications would he most likely believe Vance would benefit?,neuroleptics.,neuroleptics.,L-Dopa.; benzodiazepines.; SSRIs.
MMLU,high_school_psychology,"Lisa, determined to get away from her abusive father, leaves home and moves in with an abusive boyfriend. Lisa's choice of an abusive boyfriend is most relevant to Sigmund Freud's theory of?",psychodynamic conflict.,psychodynamic conflict.,"opposing motives.; id, ego, and superego.; behavioral dysfunction."
MMLU,high_school_psychology,The minimum amount of physical energy needed for a person to notice a stimulus is called a(n)?,absolute threshold.,absolute threshold.,JND.; difference threshold.; median difference.
MMLU,high_school_psychology,Which of the following is a stimulant medication used to treat attention-deficit/ hyperactivity disorder (ADHD)?,Adderall.,Adderall.,Strattera.; Prozac.; Zoloft.
MMLU,high_school_psychology,A population frequently studied to best assess the relative effects of nature vs. nurture is?,identical twins.,identical twins.,identical quadruplets.; adopted children and their adoptive parents.; couples who have been married for many years.
MMLU,high_school_psychology,People who suffer from major depression often have very low levels of which neurotransmitter?,serotonin.,serotonin.,thyroxin.; endocrine.; acetylcholine.
MMLU,high_school_psychology,"A research participant eats half a bowl of M&M candies, and then stops eating. How would a motivation researcher using drive reduction theory explain this participant's behavior?","The primary drive of hunger motivated the person to eat, and then stop when she/he regained homeostasis.","The primary drive of hunger motivated the person to eat, and then stop when she/he regained homeostasis.","Humans are instinctively driven to eat sugar and fat when presented to them.; The Yerkes-Dodson law explains that people will eat food when presented to them, but usually in moderate amounts in order to avoid being perceived as selfish.; The research participant was satisfying the second step on the hierarchy of needs: Food needs."
MMLU,high_school_psychology,A teacher attempts to encourage reading by exempting students from some homework assignments for each book they read. Which of the following terms best describes the behavior modification technique applied by the teacher?,Negative reinforcement.,Negative reinforcement.,Extinction.; Variable-ratio reinforcement.; Fixed-ratio reinforcement.
MMLU,high_school_psychology,"If the College Board neglected to put any questions that had to do with neuroscience on the AP Psychology exam one year, the test would lack?",content validity.,content validity.,construct validity.; predictive validity.; concurrent validity.
MMLU,high_school_psychology,"To act consistently with the group's behavior, Etan changed what he was doing. This illustrates?",conformity.,conformity.,stereotyping.; obedience to authority.; out-group homogeneity.
MMLU,high_school_psychology,"As the time for the AP Psychology exam approached, several students in the class who had not been doing homework or attending classes earlier in the term became more concerned about studying and attending regularly. Their motivation seems to be?",extrinsic.,extrinsic.,intrinsic.; instinctive.; pessimistic.
MMLU,high_school_psychology,Stimulation of norepinephrine receptors appears to produce?,alertness.,alertness.,euphoria.; increased motor activity.; anxiety.
MMLU,high_school_psychology,"Which of the following subsystems of the autonomic nervous system help the body return to ""business-as-usual"" after an emergency?",Parasympathetic nervous system.,Parasympathetic nervous system.,Somatic nervous system.; Peripheral nervous system.; Sympathetic nervous system.
MMLU,high_school_psychology,"You enter a bakery and are delighted by the aroma. After a short time, however, you no longer notice the odors because of sensory?",adaptation.,adaptation.,perception.; transduction.; detection.
MMLU,high_school_psychology,Which psychoactive drugs are most frequently prescribed to relieve pain?,narcotics.,narcotics.,stimulants.; depressants.; antidepressants.
MMLU,high_school_psychology,The instrument that has traditionally been used in sleep research to assess activity in the brain is called the?,electroencephalograph (EEG).,electroencephalograph (EEG).,signal detection device (SDD).; computerized axial tomography (CAT).; magnetic resonance imaging (MRI).
MMLU,high_school_psychology,A researcher has asked participants to complete a questionnaire that will assess how frequently in their lives they experience various emotions using a scale from 1 (never) to 5 (very often). The researcher is particularly interested in the relationship between feelings of guilt and other emotions. This researcher is most likely conducting which of the following types of research?,Correlational.,Correlational.,Demographic.; Observational.; Experimental.
MMLU,high_school_psychology,Four-year-old Kate positions herself squarely in front of all the other kids to watch a magician. Piaget would attribute this to Kate's?,egocentrism.,egocentrism.,lack of object permanence.; inability to conserve.; animism.
MMLU,high_school_psychology,What is the purpose of the Diagnostic and Statistical Manual of Mental Disorders?,to list diagnoses and symptoms so that psychologists and others can help diagnose psychological disorders.,to list diagnoses and symptoms so that psychologists and others can help diagnose psychological disorders.,"to describe the causes of psychological disorders.; to explain the biomedical symptoms, causes, and cures related to psychological disorders.; to summarize research studies regarding psychological disorders and how these diagnoses relate to one another."
MMLU,high_school_psychology,All of the following are examples of secondary drives EXCEPT?,sex.,sex.,recreation.; approval.; friendship.
MMLU,high_school_psychology,"People generally send higher contributions to charities when check-off boxes on the response card the charity sends to donors suggest $25, $35, $50, other; rather than $10, $15, $25, other. This illustrates the?",anchoring effect.,anchoring effect.,availability heuristic.; representativeness heuristic.; mental set.
MMLU,high_school_psychology,"Although many studies regarding the effects of a particular herb on memory have been conducted, results of any one study have been inconclusive. An overall conclusion might be reached by performing?",meta-analysis.,meta-analysis.,revising the data from one of the experiments.; calculating the statistical significance of each study.; cross-cultural analysis.
MMLU,high_school_psychology,Which approach emphasizes that therapists can effectively help their clients by offering unconditional positive regard?,humanistic therapy.,humanistic therapy.,Gestalt therapy.; cognitive therapy.; behavior modification.
MMLU,high_school_psychology,"Your girlfriend dumps you. ""I knew you shouldn't have gone out with her,"" says your best friend, who has never uttered this sentiment before. Your friend's comment best illustrates?",hindsight bias.,hindsight bias.,overconfidence.; a theory.; response bias.
MMLU,high_school_psychology,A math teacher refuses to look at the grades her students received in the past in math classes. The teacher is worried that looking at their past grades might influence the ways she reacts to her students. What effect is the teacher trying to avoid?,self-fulfilling prophecy.,self-fulfilling prophecy.,cognitive dissonance.; fundamental attribution error.; false-consensus effects.
MMLU,high_school_psychology,Faye believes that victims of natural disasters are foolish because they should have developed better advance detection and warning systems. Faye is manifesting the?,just-world bias.,just-world bias.,false consensus effect.; self-fulfilling prophecy effect.; self-serving bias.
MMLU,high_school_psychology,"""Behavior is personality"" best characterizes which of the following personality theories?",behavioral.,behavioral.,psychodynamic.; biological.; sociocultural.
MMLU,high_school_psychology,The fact that Will was better able to memorize his lines in the school play after finding out the meanings behind the words best illustrates the influence of?,semantic memory.,semantic memory.,chunking.; shaping.; maintenance rehearsal.
MMLU,high_school_psychology,Which of the following conditions best characterizes the focus of a behavioral model of school intervention?,Observable events.,Observable events.,Underlying psychological processes.; Relationships among children.; Events during the child's infancy.
MMLU,high_school_psychology,Which of the following endocrine glands is NOT paired with a hormone that it produces?,hypothalamus–thyroid-stimulating hormone.,hypothalamus–thyroid-stimulating hormone.,pineal–melatonin.; thyroid–thyroxine.; adrenals–cortisol.
MMLU,high_school_psychology,Which of the following drugs is classified as a stimulant?,nicotine.,nicotine.,alcohol.; heroin.; phencyclidine.
MMLU,high_school_psychology,"School psychologists serve a variety of clients, including students, parents, and systems. When individuals involved in a case cannot agree or have a conflict of interest, it is the responsibility of the school psychologist to first advocate for the needs of the?",student.,student.,school staff.; parents.; teacher.
MMLU,high_school_psychology,Why are psychoanalysts sometimes interested in talking with a patient about dreams?,Some psychoanalysts believe that dream symbols represent unconscious conflicts.,Some psychoanalysts believe that dream symbols represent unconscious conflicts.,"Psychoanalysts discovered that neurotransmitter abnormalities sometimes cause dream disturbances.; Since all people are striving for self-actualization, psychoanalysts look at the cognitive obstacles in dreams.; Nonproductive counterconditioning behaviors are sometimes revealed in dreams."
MMLU,high_school_statistics,What are the mean and standard deviation of a binomial experiment that occurs with probability of success 0.76 and is repeated 150 times?,"The mean is 114, but there is not enough information given to determine the standard deviation.","The mean is 114, but there is not enough information given to determine the standard deviation.","114, 27.35.; 100.5, 5.23.; 114, 5.23."
MMLU,high_school_statistics,"Random samples of size n are drawn from a population. The mean of each sample is calculated, and the standard deviation of this set of sample means is found. Then the procedure is repeated, this time with samples of size 4n. How does the standard deviation of the second group compare with the standard deviation of the first group?",It will be half as large.,It will be half as large.,It will be the same.; It will be twice as large.; It will be four times as large.
MMLU,high_school_statistics,"In sample surveys, what is meant by bias?",A systematic error in a sampling method that leads to an unrepresentative sample.,A systematic error in a sampling method that leads to an unrepresentative sample.,"Prejudice, as in ethnic and gender-related studies.; Natural variability seen between samples.; Tendency for some distributions to be skewed."
MMLU,high_school_statistics,Which of the following are examples of continuous data? I. The speed your car goes II. The number of outcomes of a binomial experiment III. The average temperature in San Francisco IV. The wingspan of a bird V. The jersey numbers of a football team?,"I, III, and IV only.","I, III, and IV only.","II and V only.; I, III, and V only.; II, III, and IV only."
MMLU,high_school_statistics,"A local library has a scanner to detect library materials that have not been checked out. Each item has a chip somewhere inside. Upon checkout, the chip is deactivated so the scanner will not set off the alarm. The scanner has a 98% chance of detecting an active chip (meaning the material has not been checked out) and setting off the alarm. The scanner also has a 3% chance of sounding the alarm when someone passes through without an active chip. It is estimated that 0.5% of library customers actually try to leave the library with an active chip. What is the probability that, if the alarm sounds, the patron leaving the library has an item with an active chip?",0.141.,0.141.,0.0049.; 0.0348.; 0.97.
MMLU,high_school_statistics,"A skeptic decides to conduct an experiment in ESP in which a blindfolded subject calls out the color of a card dealt from a regular deck of cards (half the cards are red; the other half, black). One hundred cards are dealt from a well-shuffled pack, with each card being replaced after a deal. Using a 5 percent level of significance, what is the lowest number of cards that the subject needs to call out correctly in order to show that he is doing better than he would if he were simply guessing?",59.,59.,51.; 75.; 95.
MMLU,high_school_statistics,A survey was conducted to determine the percentage of parents who would support raising the legal driving age to 18. The results were stated as 67% with a margin of error of ±3%. What is meant by ±3%?,It is unlikely that the given sample proportion result could be obtained unless the true percentage was between 64% and 70%.,It is unlikely that the given sample proportion result could be obtained unless the true percentage was between 64% and 70%.,"Three percent of the population were not surveyed.; In the sample, the percentage of parents who would support raising the driving age is between 64% and 70%.; The percentage of the entire population of parents who would support raising the driving age is between 64% and 70%."
MMLU,high_school_statistics,"In basketball, an offensive rebound occurs when a player shoots and misses, and a player from the same team recovers the ball. For the 176 players on the roster for one season of professional men's basketball, the third quartile for the total number of offensive rebounds for one season was 143. If five players are selected at random (with replacement) from that season, what is the approximate probability that at least three of them had more than 143 rebounds that season?",0.1035.,0.1035.,0.0127.; 0.0879.; 0.8965.
MMLU,high_school_statistics,For which of these is a binomial probability model most reasonable?,"The number of times, out of 10 attempts, that a particular child can throw a ball into a basket from six feet away.","The number of times, out of 10 attempts, that a particular child can throw a ball into a basket from six feet away.",The colors of the cars in the parking lot of a particular grocery store on a randomly selected Sunday.; The number of times that a randomly selected resident of California has visited a museum in the last 12 months.; The number of cards drawn from a well-shuffled deck until all four aces are found.
MMLU,high_school_statistics,"According to the central limit theorem, the sample mean X is approximately normally distributed?","for a large sample, regardless of the distribution of random variable X.","for a large sample, regardless of the distribution of random variable X.","for a large sample, provided the random variable X is normally distributed.; regardless of the sample size.; for a small sample, regardless of the distribution of random variable X."
MMLU,high_school_statistics,"Jonathan obtained a score of 80 on a statistics exam, placing him at the 90th percentile. Suppose five points are added to everyone's score. Jonathan's new score will be at the?",90th percentile.,90th percentile.,80th percentile.; 85th percentile.; 95th percentile.
MMLU,high_school_statistics,For which of the following purposes would it be most unreasonable to use a census?,To determine the proportion of red snappers with a high mercury level in the Gulf of Mexico.,To determine the proportion of red snappers with a high mercury level in the Gulf of Mexico.,To determine the proportion of students with a learning disability in a small rural area high school.; To determine the difference between the proportion of engineering professors and the proportion of business professors in favor of the new teaching initiative at a large university.; To determine the mean wage earned by construction workers in a small town.
MMLU,high_school_statistics,A random sample of families was taken in order to estimate the relation between fertility and level of education (measured in number of years). A confidence interval needs to be constructed for the slope of the regression line. The social worker in charge of the project is debating whether to use a 90 percent or a 95 percent confidence interval. Which of the following statements about the length of these intervals is true?,The 95 percent confidence interval will be wider than the 90 percent confidence interval.,The 95 percent confidence interval will be wider than the 90 percent confidence interval.,"The 95 percent confidence interval will be narrower than the 90 percent confidence interval.; Both intervals will be of the same length, because they are computed from the same sample.; The length of the confidence interval will depend on the sample size, not on the confidence level."
MMLU,high_school_statistics,A particular crop of one variety of onion has weights that are approximately normally distributed with mean 9.8 oz. and standard deviation 2.1 oz. How does an onion in the 28th percentile for weight compare to the mean?,1.22 ounces below the mean.,1.22 ounces below the mean.,0.59 ounces below the mean.; 0.59 ounces above the mean.; 1.22 ounces above the mean.
MMLU,high_school_statistics,"A set consists of four numbers. The largest value is 200, and the range is 50. Which of the following statements is true?",The median is the mean of the second and third numbers if the set is arranged in ascending order.,The median is the mean of the second and third numbers if the set is arranged in ascending order.,The mean is less than 185.; The mean is greater than 165.; The median is less than 195.
MMLU,high_school_statistics,Which of the following is a true statement?,Stratifying in sampling is the same idea as blocking for experiments.,Stratifying in sampling is the same idea as blocking for experiments.,"While observational studies gather information on an already existing condition, they still often involve intentionally forcing some treatment to note the response.; In an experiment, researchers decide on the treatment but typically allow the subjects to self-select into the control group.; If properly designed, either observational studies or controlled experiments can easily be used to establish cause and effect."
MMLU,high_school_statistics,"The number of leasable square feet of office space available in a city on any given day has a normal distribution with mean 640,000 square feet and standard deviation 18,000 square feet. What is the interquartile range for this distribution?","652,000 - 628,000.","652,000 - 628,000.","658,000 - 622,000.; 667,000 - 613,000.; 676,000 - 604,000."
MMLU,high_school_statistics,A sample of size 35 is to be drawn from a large population. The sampling technique is such that every possible sample of size 35 that could be drawn from the population is equally likely. What name is given to this type of sample?,Simple random sample.,Simple random sample.,Systematic sample.; Cluster sample.; Voluntary response sample.
MMLU,high_school_statistics,"In the correlation coefficient r = 0.78, what percentage of variation in y is explained by the linear regression model?",61%.,61%.,22%.; 39%.; 44%.
MMLU,high_school_statistics,"To conduct a survey of which long distance carriers are used in a particular locality, a researcher opens a telephone book to a random page, closes his eyes, puts his finger down on the page, and then calls the next 75 names. Which of the following is a correct statement?","While the survey design does incorporate chance, the procedure could easily result in selection bias.","While the survey design does incorporate chance, the procedure could easily result in selection bias.",The procedure results in a simple random sample.; This is an example of cluster sampling with 26 clusters.; This is an example of stratified sampling with 26 strata.
MMLU,high_school_statistics,The distribution of weights of 16-ounce bags of a particular brand of potato chips is approximately normal with a standard deviation of 0.28 ounce. How does the weight of a bag at the 40th percentile compare with the mean weight?,0.07 ounce below the mean.,0.07 ounce below the mean.,0.40 ounce above the mean.; 0.25 ounce above the mean.; 0.07 ounce above the mean.
MMLU,high_school_statistics,"Suppose 4% of the population have a certain disease. A laboratory blood test gives a positive reading for 95% of people who have the disease and for 5% of people who do not have the disease. If a person tests positive, what is the probability the person has the disease?",0.442.,0.442.,0.038.; 0.086.; 0.558.
MMLU,high_school_statistics,"Two variables, xand y, seem to be exponentially related. The natural logarithm of each yvalue is taken and the least-squares regression line of ln(y) on xis determined to be ln(y) = 3.2 + 0.42x. What is the predicted value of ywhen x= 7?",464.05.,464.05.,1380384.27.; 521.35.; 6.14.
MMLU,high_school_us_history,"This question refers to the following information.
Our leaders talk about stopping aggression from the north, but this was a struggle among groups of Vietnamese until we intervened. We seem bent upon saving the Vietnamese from Ho Chi Minh even if we have to kill them and demolish their country to do it. As the native people survey bombed-out villages, women and children burned by napalm, rice crops destroyed and cities overrun with our military personnel, they are doubtless saying secretly of the Vietcong guerillas and of the American forces, ""A plague on both your houses."" … Stop the bombing, north and south, end search and destroy offensive sweeps, and confine our military action to holding operations on the ground. Bombing the north has failed to halt or seriously check the flow of troops to the south and may, in fact, have prompted a much greater war effort by Hanoi.
—Senator George McGovern, ""The Lessons of Vietnam,"" April 25, 1967
The sentiments expressed in the speech most directly reflect which popular attitude that became widespread in the 1960s?",Government statements about Vietnam could not be trusted.,Government statements about Vietnam could not be trusted.,The United States should embrace isolationism.; The United States should use force to spread American ideals abroad.; American commanders were not being given enough weapons in Vietnam.
MMLU,high_school_us_history,"This question refers to the following information.
""As a means of effecting this end I suggest for your consideration the propriety of setting apart an ample district west of the Mississippi, and without the limit of any State or Territory now formed, to be guaranteed to the Indian tribes as long as they shall occupy it. . . . There they may be secured in the enjoyment of governments of their own choice, subject to no other control from the United States than such as may be necessary to preserve peace on the frontier and between the several tribes. There the benevolent may endeavor to teach them the arts of civilization. . . .
""This emigration would be voluntary, for it would be as cruel and unjust to compel the aborigines to abandon the graves of their fathers and seek a home in a distant land. But they should be distinctly informed that if they remain within the limits of the States they must be subject to their laws. . . .""
—President Andrew Jackson, 1829
Martin Luther King was in jail in Birmingham, Alabama, because of his belief in protesting injustice through the use of?",nonviolent direct action.,nonviolent direct action.,targeted assassinations of segregationist public officials.; massive letter-writing campaigns denouncing segregated businesses.; violent self-defense.
MMLU,high_school_us_history,"This question refers to the following information.
""One-half of the people of this nation to-day are utterly powerless to blot from the statute books an unjust law, or to write there a new and a just one. The women, dissatisfied as they are with this form of government, that enforces taxation without representation,—that compels them to obey laws to which they have never given their consent,—that imprisons and hangs them without a trial by a jury of their peers, that robs them, in marriage, of the custody of their own persons, wages and children,—are this half of the people left wholly at the mercy of the other half, in direct violation of the spirit and letter of the declarations of the framers of this government, every one of which was based on the immutable principle of equal rights to all.""
—Susan B. Anthony, ""I Stand Before You Under Indictment"" (speech), 1873
The actions taken by Andrew Carnegie that were critiqued in the cartoon reflected the thinking of which of the following concepts?",The Gospel of Wealth.,The Gospel of Wealth.,The Social Gospel.; Survival of the Fittest.; Rugged individualism.
