Type,Category,Question,Best Answer,Correct Answers,Incorrect Answers
MMLU,abstract_algebra,The cyclic subgroup of Z_24 generated by 18 has order?,4.,4.,8.; 12.; 6.
MMLU,abstract_algebra,Find the order of the factor group Z_6/<3>.,3.,3.,2.; 6.; 12.
MMLU,abstract_algebra,Statement 1 | A permutation that is a product of m even permutations and n odd permutations is an even permutation if and only if n is even. Statement 2 | Every group is isomorphic to a group of permutations.,"True, True.","True, True.","False, False.; True, False.; False, True."
MMLU,abstract_algebra,Find the order of the factor group (Z_4 x Z_12)/(<2> x <2>)?,4.,4.,2.; 3.; 12.
MMLU,abstract_algebra,Find the maximum possible order for some element of Z_4 x Z_6.,12.,12.,4.; 6.; 24.
MMLU,abstract_algebra,Statement 1 | The symmetric group S_3 is cyclic. Statement 2 | Every group is isomorphic to some group of permutations.,"False, True.","False, True.","True, True.; False, False.; True, False."
MMLU,abstract_algebra,"Statement 1 | If a and b are elements of finite order in an Abelian group, then |ab| is the lcm (|a|,|b|). Statement 2 | If g is a group element and g^n = e, then |g| = n.","False, False.","False, False.","True, True.; True, False.; False, True."
MMLU,abstract_algebra,"Statement 1 | If f is a homomorphism from G to K and H is normal in G then f(H) is normal in K. Statement 2 | If f is a homomorphism from G to a group and H is finite subgroup of G, then |f(H)| divides |H|.","False, True.","False, True.","True, True.; False, False.; True, False."
MMLU,abstract_algebra,Find the maximum possible order for an element of S_n for n = 7.,12.,12.,6.; 30.; 105.
MMLU,abstract_algebra,Statement 1 | Every integral domain has a field of quotients. Statement 2 | A polynomial of degree n over a ring can have at most n zeros counting multiplicity.,"True, False.","True, False.","True, True.; False, False.; False, True."
MMLU,abstract_algebra,"Statement 1 | If a group has an element of order 10, then the number of elements of order 10 is divisible by 4. Statement 2 | If m and n are positive integers and phi is the Euler phi function, then phi(mn) = phi(m)phi(n).","False, False.","False, False.","True, True.; True, False.; False, True."
MMLU,anatomy,Which of the following terms describes the body's ability to maintain its normal state?,Homeostasis.,Homeostasis.,Anabolism.; Catabolism.; Tolerance.
MMLU,anatomy,Which of the following structures travel through the substance of the parotid gland?,The maxillary artery and retromandibular vein.,The maxillary artery and retromandibular vein.,"The maxillary artery.; The maxillary artery, retromandibular vein and facial artery.; The maxillary artery, retromandibular vein, facial artery and buccal branch of the mandibular nerve."
MMLU,anatomy,A medical practitioner places a stethoscope over the patient's seventh right intercostal space in the mid-axillary line. The stethoscope overlies the?,lower lobe of the lung.,lower lobe of the lung.,upper lobe of the lung.; middle lobe of the lung.; costo-diaphragmatic recess.
MMLU,anatomy,The maxillary sinus?,is innervated by branches of the maxillary division of the trigeminal nerve.,is innervated by branches of the maxillary division of the trigeminal nerve.,is lined by stratified squamous epithelium.; drains into the superior meatus of the nasal cavities.; Receives its blood supply from the first part of the maxillary artery.
MMLU,anatomy,Which of the following is flexible connective tissue that is attached to bones at the joints?,Cartilage.,Cartilage.,Adipose.; Epithelial.; Muscle.
MMLU,anatomy,Tonsillar tissue is commonly found?,between the palatoglossal and palatopharyngeal folds.,between the palatoglossal and palatopharyngeal folds.,on the posterior wall of the oropharynx.; under the mucosa of the ventral surface of the tongue.; at all three sites.
MMLU,anatomy,The best place to listen to the general heart sound with a stethoscope is the?,fifth left intercostal space in the midclavicular line.,fifth left intercostal space in the midclavicular line.,second left intercostal space one inch from the sternum.; third left rib at its junction with the sternum.; sternum midway between the sternal angle and xiphisternum.
MMLU,anatomy,Emissary veins connect the intracranial venous sinuses to?,All of the above areas.,All of the above areas.,veins draining the scalp.; veins draining the eye.; the pterygoid venous plexus.
MMLU,anatomy,Smooth muscle cells contain?,actin and myosin arranged irregularly.,actin and myosin arranged irregularly.,actin but not myosin.; myosin but not actin.; actin and myosin arranged in parallel arrays.
MMLU,anatomy,"Which of the following controls body temperature, sleep, and appetite?",Hypothalamus.,Hypothalamus.,Adrenal glands.; Pancreas.; Thalamus.
MMLU,anatomy,Which one of the following is brought about by activation of sympathetic nerves?,Dilation of the pupil of the eye.,Dilation of the pupil of the eye.,Contraction of bronchial smooth muscle.; Increase in intestinal secretion.; Decrease in heart rate.
MMLU,anatomy,The trachea?,lies superficial to the oesophagus.,lies superficial to the oesophagus.,lies deep to the oesophagus.; is totally enclosed by cartilaginous rings.; divides at the thoracic inlet.
MMLU,anatomy,Pharyngeal mucosa is innervated by the glossopharyngeal nerves because it develops from the?,third pharyngeal arch.,third pharyngeal arch.,first pharyngeal arch.; second pharyngeal arch.; fourth pharyngeal arch.
MMLU,anatomy,A patient is most likely to experience pain due to infection of the ethmoidal air cells sinus?,between the eyes.,between the eyes.,at the base of the skull.; on the forehead.; in the cheeks.
MMLU,astronomy,You cool a blackbody to half its original temperature. How does its spectrum change?,"Power emitted is 1/16 times as high, peak emission wavelength is 2 times longer.","Power emitted is 1/16 times as high, peak emission wavelength is 2 times longer.","Power emitted is 1/16 times as high, peak emission wavelength is 1/2 as long.; Power emitted is 1/4 times as high, peak emission wavelength is 2 times longer.; Power emitted is 1/4 times as high, peak emission wavelength is 1/2 as long."
MMLU,astronomy,What drives differentiation?,The minimization of gravitational potential energy.,The minimization of gravitational potential energy.,Spontaneous emission from radioactive atoms.; Thermally induced collisions.; Plate tectonics.
MMLU,astronomy,How did the lunar maria form?,Large impacts fractured the Moon's lithosphere allowing lava to fill the impact basins.,Large impacts fractured the Moon's lithosphere allowing lava to fill the impact basins.,The giant impact that created the Moon left smooth areas that we call the maria.; Volatiles escaping from the Moon's interior heated and eroded the surface in the regions of the maria.; The early bombardment created heat that melted the lunar surface in the regions of the maria.
MMLU,astronomy,Why doesn't Venus have seasons like Mars and Earth do?,Its rotation axis is nearly perpendicular to the plane of the Solar System.,Its rotation axis is nearly perpendicular to the plane of the Solar System.,It does not have an ozone layer.; It does not rotate fast enough.; It is too close to the Sun.
MMLU,astronomy,The mass of Saturn's rings is 2x1019 kg. What is the ratio of this mass to that of a 200 km diameter spherical moon made entirely of water-ice (density ~ 1 g/cm3)? That is what is Mrings : Micy moon?,5 : 1.,5 : 1.,1 : 1.; 50 : 1.; 0.5 : 1.
MMLU,astronomy,Which mechanism can NOT explain Mercury's lack of a permanent atmosphere?,Volcanic Heating.,Volcanic Heating.,Impact Heating.; Ablation by the solar wind.; Thermal Escape.
MMLU,astronomy,Which property of our solar system does a formation theory NOT need to explain?,the presence of life on Earth.,the presence of life on Earth.,patterns of motion.; the presence of asteroids and comets.; the measured ages of meteorites.
MMLU,astronomy,What dangers are currently faced by each Mars Exploration Rover?,"Opportunity may not be able to move its arm again, Spirit may not get enough solar power during the winter months immediately ahead.","Opportunity may not be able to move its arm again, Spirit may not get enough solar power during the winter months immediately ahead.","Opportunity may not be able to drive out of Victoria Crater due to its broken sixth wheel, Spirit's instruments are being corroded by the acidic hot spring environment it is exploring.; Opportunity may not be able to move its arm again, Spirit may not be able to drive out of Victoria Crater due to its broken sixth wheel.; Opportunity may not be able to drive out of Victoria Crater due to its broken sixth wheel, Spirit may not get enough solar power during the winter months immediately ahead."
MMLU,astronomy,The reason that small planets tend to lose interior heat faster than larger planets is essentially the same as the reason that ________.,a large baked potato takes longer to cool than a small baked potato.,a large baked potato takes longer to cool than a small baked potato.,Earth contains more metal than the Moon.; thunderstorms tend to form on hot summer days.; gas bubbles form and rise upward in boiling water.
MMLU,astronomy,If the Moon is setting at noon the phase of the Moon must be?,third quarter.,third quarter.,waning crescent.; waxing crescent.; full.
MMLU,astronomy,In astronomy the concept of black bodies is very important to better calculate the radiation of stars. Which one is the correct definition of a black body?,An idealized physical object that absorbs all electromagnetic radiation.,An idealized physical object that absorbs all electromagnetic radiation.,An idealized physical object that reflects all electromagnetic radiation.; An idealized physical object that reflects all polarized radiation.; An idealized physical object that absorbs all polarized radiation.
MMLU,astronomy,The Coriolis effect is observed on planets because?,they are rotating and spherical so different latitudes rotate at different speeds (meters/second).,they are rotating and spherical so different latitudes rotate at different speeds (meters/second).,their surfaces rotate at the same speed (meters/second) at all latitudes.; they rotate and have magnetic fields.; the solar wind interacts with their magnetospheres.
MMLU,astronomy,The International Space Station (ISS) circles the Earth approximately 410 km above the ground. Find the best estimate for the orbital speed of the ISS:?,28000 km/h.,28000 km/h.,19000 km/h.; 21000 km/h.; 32000 km/h.
MMLU,astronomy,Which is the least likely cause of death?,Being hit by a small meteorite.,Being hit by a small meteorite.,Being hit in the head by a bullet.; Starvation during global winter caused by a major impact.; Driving while intoxicated without wearing seatbelts.
MMLU,astronomy,How have we been able to construct detailed maps of surface features on Venus?,by using radar from spacecraft that were sent to orbit Venus.,by using radar from spacecraft that were sent to orbit Venus.,by studying Venus from Earth with powerful optical telescopes.; by landing spacecraft on the surface for close-up study.; by studying Venus with powerful optical telescopes on spacecraft that were sent to orbit Venus.
MMLU,astronomy,A comet’s tail points in the following direction:?,away from the Sun.,away from the Sun.,towards the Sun.; in the direction of movement.; against the direction of movement.
MMLU,business_ethics,Disqualification of directors may result from breaches under the?,Companies Act 2006 and Insolvency Act 1986.,Companies Act 2006 and Insolvency Act 1986.,Sale of Goods Act 1979.; Financial Services Act 1986.; Health and Safety at Work Act 1974.
MMLU,business_ethics,"In a global context, many companies have significant ______ power due to their ability to threaten governments, in the face of ________ with relocation to other territories, which Beck (1998) describes as 'corporate power of _______.","Political, Undesirable regulation, Transnational withdrawal.","Political, Undesirable regulation, Transnational withdrawal.","Economic, Commercial competition, Social sanction.; Social, Commercial competition, Social sanction.; Social, Undesirable regulation, Transnational withdrawal."
MMLU,business_ethics,Ethics of duty is a principle based ethical theory attributed to Emmanuel Kant.,"1,3.","1,3.","2,3.; 1,2.; 1,2,3."
MMLU,business_ethics,"While businesses traditionally engaged in civil society through ______, recently more business-________ collaboration have emerged in order to tackle social and environmental problems. Likewise, CSO's strategies have evolved with an increasing number setting up _________, which are more commercially orientated then traditional charity models.","Philanthropy, CSO, Social enterprises.","Philanthropy, CSO, Social enterprises.","Philanthropy, Government, Lobbying groups.; Advertising campaigns, CSO, Lobbying groups.; Advertising campaigns, Government, Social enterprises."
MMLU,business_ethics,"The relationship between shareholders and the company, or so called ________, describes shareholders as _________ and managers of the company as ________.","Agency relation, Principal, Agents.","Agency relation, Principal, Agents.","Agency relation, Agent, Principals.; Stakeholder management, Agent, Principals.; Stakeholder management, Principal, Agents."
MMLU,business_ethics,Executive directors are responsible for running the firm.,"1,4.","1,4.","1,3.; 2,3.; 1,2,3."
MMLU,business_ethics,Subjection to emotional exploitation.,"1,3,4.","1,3,4.","1,2,4.; 2,3,4.; 1,2,3,4,5."
MMLU,business_ethics,The recent global sustainability agenda has been dominated by which of the following organisations sustainability goals?,United Nations 'Sustainable Development Goals'.,United Nations 'Sustainable Development Goals'.,Marks & Spencer's 'Plan A'.; The Alibaba Group's 'Sustainability Initiatives'.; Unilever's 'Sustainable Living Plan'.
MMLU,business_ethics,The OECD argues that corporate governance problems arise because:?,Ownership and control is separated.,Ownership and control is separated.,Managers always act in their own self interest.; Profit maximization is the main objective of organizations.; Stakeholders have differing levels of power.
MMLU,business_ethics,What is meant by the phrase CSR?,Corporate Social Responsibility.,Corporate Social Responsibility.,Company Social Responsibility.; Corporate Society Responsibility.; Company Society Responsibility.
MMLU,business_ethics,"______, ________ and _______ are all factors which can impinge upon stakeholder communication and collaboration.","Resource intensity, Culture clash, Accountability.","Resource intensity, Culture clash, Accountability.","Resource clash, Culture intensity, Accountability.; Resource intensity, Culture clash, Coordinative fluidity.; Resource clash, Culture clash, Coordinative fluidity."
MMLU,clinical_knowledge,Type I muscle fibres have the following characteristics:?,"red, oxidative, slow contracting.","red, oxidative, slow contracting.","white, glycolytic, slow contracting.; white, oxidative, slow contracting.; red, oxidative, fast contracting."
MMLU,clinical_knowledge,Mr Wood has just returned from surgery and has severe internal bleeding. Which of the following observations would you NOT expect to find on undertaking post-operative observations?,Bradycardia.,Bradycardia.,Hypotension.; Confusion.; Tachypnoea.
MMLU,clinical_knowledge,Which of the following represents Cushing's response?,"High blood pressure, bradycardia.","High blood pressure, bradycardia.","Low blood pressure, tachycardia.; High blood pressure, tachycardia.; Low blood pressure, bradycardia."
MMLU,clinical_knowledge,How many 'true' movements are available at the hip?,6.,6.,4.; 5.; 7.
MMLU,clinical_knowledge,"For patients with asthma, how many times a day should a peak flow reading be taken?",Twice a day.,Twice a day.,Daily.; Three times a week.; Once a week.
MMLU,clinical_knowledge,Which of the following is incorrect?,Dentures should be stored dry.,Dentures should be stored dry.,Dentures should be removed at night.; Dentures should be cleaned on removal from mouth.; Dentures should be stored in a named pot.
MMLU,clinical_knowledge,Why might you choose to use a silicone catheter (as of 2020 medical knowledge)?,Because the patient is allergic to latex.,Because the patient is allergic to latex.,Because the patient does not like the others.; Because there are no other kinds of catheter at your disposal.; Because it is cheaper.
MMLU,clinical_knowledge,The recommended dose of creatine to load the muscles of a 70 kg man within one week is:?,20 g/day.,20 g/day.,2 g/day.; 5 g/day.; 10 g/day.
MMLU,clinical_knowledge,The coding sequences of genes are called:?,exons.,exons.,extrons.; introns.; codons.
MMLU,clinical_knowledge,Which of the following is true with regards to the anatomy involved in the rectal examination?,The cervix can sometimes be felt anteriorly in the female.,The cervix can sometimes be felt anteriorly in the female.,The sacrum is palpated anteriorly.; The pubic bone is palpated anteriorly in both sexes.; In the male the testes can be appreciated anteriorly.
MMLU,clinical_knowledge,Using a large volume spacer will improve the deposition of medication by:?,40-60%.,40-60%.,10-15%.; 99-100%.; 30-40%.
MMLU,clinical_knowledge,Which one of the following is not a use for intravenous infusions?,To orally hydrate a patient.,To orally hydrate a patient.,Administer prescribed intravenous fluid.; Administer dyes or contrast media for radiographic examinations.; Administer prescribed blood products.
MMLU,clinical_knowledge,"During exercise, adrenaline secretion from the adrenal glands is stimulated by:?",increased sympathetic nerve activity.,increased sympathetic nerve activity.,increased plasma glucose.; increased plasma fatty acids.; increased plasma ACTH.
MMLU,clinical_knowledge,Which of the following is true of blackouts and dizziness?,Confusion following a blackout is strongly suggestive of a fit.,Confusion following a blackout is strongly suggestive of a fit.,Pre-syncope is another term for a blackout.; An epileptic fit always leads to the loss of consciousness.; In the investigation of a blackout a blood sugar estimation is of no value.
MMLU,clinical_knowledge,Which of the following is true about abdominal pain?,The pain of oesophagitis is usually retrosternal in site.,The pain of oesophagitis is usually retrosternal in site.,Peptic ulcer pain is usually experienced in the hypogastrium.; The pain of irritable bowel syndrome is usually well localised.; The pain of pancreatitis usually radiates to the groin.
MMLU,clinical_knowledge,The following are features of Alzheimer's disease except:?,drowsiness.,drowsiness.,short-term memory loss.; confusion.; poor attention.
MMLU,clinical_knowledge,Which of the following is true about radial nerve palsy?,It leads to wrist drop.,It leads to wrist drop.,The radial nerve arises from the lateral cord of the brachial plexus.; It is associated with sensory loss over the medial half of the hand.; It can occur due to a superficial laceration over the wrist.
MMLU,clinical_knowledge,How can several different proteins be produced from the same gene?,"The primary transcripts of many genes can be spliced in various ways to produce different mRNAs, a process known as alternative RNA splicing.","The primary transcripts of many genes can be spliced in various ways to produce different mRNAs, a process known as alternative RNA splicing.",By selective transcription of different parts of the DNA in the gene.; By doubling or tripling the length of the mRNA molecule produced from the primary transcript.; By splicing of the mRNA molecule after it has been formed from the primary transcript.
MMLU,clinical_knowledge,How long can a long-term catheter stay in situ?,12 weeks.,12 weeks.,4 weeks.; 7 weeks.; 20 weeks.
MMLU,clinical_knowledge,Stridor is described as:?,A high-pitched sound.,A high-pitched sound.,A wheezing sound.; A gurgling sound.; A rattling sound.
MMLU,clinical_knowledge,What is cardiac output?,Stroke volume × heart rate.,Stroke volume × heart rate.,Systemic vascular resistance × heart rate.; Blood pressure × heart rate.; Preload × stroke volume.
MMLU,clinical_knowledge,Which of the following is true about the assessment of gait?,An antalgic gait is caused by a painful leg.,An antalgic gait is caused by a painful leg.,A stamping gait is caused by bilateral foot drop.; A waddling gait is sometimes called a steppage gait.; An apraxic gait is due to hysteria.
MMLU,clinical_knowledge,What should be done after catheterization is carried out?,Document catheterization in the patient's notes.,Document catheterization in the patient's notes.,The patient should be thanked.; The patient should be advised when to drink.; The patient should be washed.
MMLU,clinical_knowledge,In a patient with chest pain which of these features is most suggestive of a myocardial infarction?,Sweating and vomiting.,Sweating and vomiting.,Very severe pain.; Pain has lasted for over a week.; Pain is sharp like a knife.
MMLU,clinical_knowledge,In the assessment of visual fields which of the following is true?,An enlarged blind spot may occur because of papilloedema.,An enlarged blind spot may occur because of papilloedema.,A lesion at the optic chiasma leads to a homonymous hemianopia.; Impulses from the retinal leave the eye via the optic radiation.; The visual field examination maps out a patient's central vision.
MMLU,clinical_knowledge,Who set the world record for the mile race in 1886?,WG George.,WG George.,R Bannister.; S Coe.; J DiMaggio.
MMLU,clinical_knowledge,What is erythema?,Redness of the skin due to congestion of the capillaries.,Redness of the skin due to congestion of the capillaries.,Inflammation of the sweat glands.; A form of skin infection.; Redness of the skin caused by pressure.
MMLU,clinical_knowledge,"When branched chain amino acids are deaminated in muscle, the ammonia produced is mostly:?",converted into alanine and glutamine and released from the muscle.,converted into alanine and glutamine and released from the muscle.,converted into arginine and released from the muscle.; converted into urea and released from the muscle.; used to synthesise purines and pyrimidines in the muscle.
MMLU,clinical_knowledge,Which of the following is true regarding the examination of the legs?,The root value of toe extension is L5.,The root value of toe extension is L5.,"Sustained clonus occurs with hypotonia.; Clonus can only be demonstrated at the ankle.; The root value of hip flexion is L4, L5."
MMLU,college_biology,Which of the following is the most direct cause of polyteny in somatic cells of certain organisms?,Chromosome replication without cell division.,Chromosome replication without cell division.,RNA transcription.; Supercoiling of chromatin.; Chromosome recombination.
MMLU,college_biology,All of the following statements about muscle contraction are true EXCEPT:?,Calcium-tropomyosin binding precedes actin-myosin binding.,Calcium-tropomyosin binding precedes actin-myosin binding.,The ends of actin filaments move closer together.; The length of myosin filaments does not change.; Calcium-troponin binding precedes actin-myosin binding.
MMLU,college_biology,Short-term changes in plant growth rate mediated by the plant hormone auxin are hypothesized to result from?,increased extensibility of the walls of affected cells.,increased extensibility of the walls of affected cells.,loss of turgor pressure in the affected cells.; suppression of metabolic activity in affected cells.; cytoskeletal rearrangements in the affected cells.
MMLU,college_biology,"RNA is thought to have played an important role in the evolution of life for which of the following reasons?
I. It occurred in great quantities on early Earth.
II. It can self-replicate via a complementary chain.
III. It can catalyze some cellular functions.",II and III.,II and III.,I only.; II only.; III only.
MMLU,college_biology,"An organism with a lobed thallus, rhizoids, and gemmae is a?",liverwort.,liverwort.,moss.; fern.; mushroom.
MMLU,college_biology,"One hypothesis posed by evolutionary biologists to account for an organism's altruistic behavior in social groups is that of kin selection. According to the kin selection theory, the risk incurred by a bird that sounds an alarm call due to a nearby predator may be offset by the fact that?",the alarm call will benefit those members with whom the bird shares a percentage of its genes.,the alarm call will benefit those members with whom the bird shares a percentage of its genes.,the alarm call induces the predator to abandon its hunt.; the alarm call allows the bird to gain protection at the center of a flock.; the bird will gain the same early warning advantage from another member of the flock at a future time.
MMLU,college_biology,"A plant that possesses swimming sperm, xylem with tracheids, independent gametophyte and sporophyte phases, and no seeds is probably most closely related to?",ferns.,ferns.,mosses.; pines.; liverworts.
MMLU,college_biology,Which of the following is NOT a characteristic of an oligotrophic lake?,Shallow water.,Shallow water.,Low nutrient levels.; High altitudes.; Sand or gravel bottom.
MMLU,college_biology,Evidence that sea urchins are more closely related to frogs than they are to snails is that echinoderms and chordates share which of the following embryological features?,The pore that forms the mouth develops after the pore that forms the anus.,The pore that forms the mouth develops after the pore that forms the anus.,An embryonic notochord disappears by the adult stage.; Larvae undergo metamorphosis.; Early embryos are unable to compensate for missing cells.
